{
  "equipmentTemplates": [
    { "name": "Iron Dagger",         "description": "A short blade honed from iron. Reliable in close quarters.",              "category": "Weapon",    "slot": "MeleeWeapon",  "minWorkmanship": 1, "maxWorkmanship": 3 },
    { "name": "Iron Sword",          "description": "A straight iron sword, workhorse of the Aeldran roads.",                  "category": "Weapon",    "slot": "MeleeWeapon",  "minWorkmanship": 2, "maxWorkmanship": 5 },
    { "name": "Stone Axe",           "description": "A heavy axe with a hand-knapped stone head. Brutal and primitive.",        "category": "Weapon",    "slot": "MeleeWeapon",  "minWorkmanship": 1, "maxWorkmanship": 3 },
    { "name": "Battle Hammer",       "description": "A two-handed maul fitted with an iron-capped head. Bone-breaking.",        "category": "Weapon",    "slot": "MeleeWeapon",  "minWorkmanship": 3, "maxWorkmanship": 6 },
    { "name": "War Pick",            "description": "A compact pick with a hardened iron point. Punches through plate.",        "category": "Weapon",    "slot": "MeleeWeapon",  "minWorkmanship": 2, "maxWorkmanship": 5 },

    { "name": "Thornwood Bow",       "description": "A recurve bow carved from resilient thornwood.",                           "category": "Weapon",    "slot": "RangedWeapon", "minWorkmanship": 2, "maxWorkmanship": 4 },
    { "name": "Hunter's Crossbow",   "description": "A compact crossbow favored by Aeldran forest scouts.",                     "category": "Weapon",    "slot": "RangedWeapon", "minWorkmanship": 3, "maxWorkmanship": 6 },
    { "name": "Sling",               "description": "A simple sling of woven sinew. Cheap but accurate.",                       "category": "Weapon",    "slot": "RangedWeapon", "minWorkmanship": 1, "maxWorkmanship": 2 },

    { "name": "Oak Wand",            "description": "A slender oak wand that channels Weave with little resistance.",           "category": "Weapon",    "slot": "Focus",        "minWorkmanship": 1, "maxWorkmanship": 3 },
    { "name": "Crystal Focus",       "description": "A multifaceted crystal sphere that amplifies magical resonance.",           "category": "Weapon",    "slot": "Focus",        "minWorkmanship": 3, "maxWorkmanship": 6 },
    { "name": "Ashwood Staff",       "description": "A tall ashwood staff worn smooth by long use. Reliable conduit.",          "category": "Weapon",    "slot": "Focus",        "minWorkmanship": 2, "maxWorkmanship": 5 },

    { "name": "Leather Cap",         "description": "Cured hide shaped into a simple helm.",                                    "category": "Armor",     "slot": "Head",         "minWorkmanship": 1, "maxWorkmanship": 3 },
    { "name": "Scale Coif",          "description": "Overlapping iron scales form a tight hood.",                               "category": "Armor",     "slot": "Head",         "minWorkmanship": 3, "maxWorkmanship": 6 },
    { "name": "Iron Helm",           "description": "A forged iron helm with a narrow visor. Heavy but protective.",            "category": "Armor",     "slot": "Head",         "minWorkmanship": 4, "maxWorkmanship": 7 },
    { "name": "Fur Hood",            "description": "A thick fur hood sewn from heavy pelts. Warm and surprisingly resilient.", "category": "Armor",     "slot": "Head",         "minWorkmanship": 1, "maxWorkmanship": 3 },

    { "name": "Leather Vest",        "description": "A padded leather body vest offering moderate protection.",                 "category": "Armor",     "slot": "Chest",        "minWorkmanship": 2, "maxWorkmanship": 4 },
    { "name": "Chain Shirt",         "description": "Interlocked iron rings form a flexible hauberk.",                          "category": "Armor",     "slot": "Chest",        "minWorkmanship": 3, "maxWorkmanship": 6 },
    { "name": "Padded Gambeson",     "description": "Layers of quilted cloth that absorb shock surprisingly well.",             "category": "Armor",     "slot": "Chest",        "minWorkmanship": 1, "maxWorkmanship": 3 },

    { "name": "Leather Leggings",    "description": "Thick leather greaves strapped over the thighs and shins.",                "category": "Armor",     "slot": "Legs",         "minWorkmanship": 1, "maxWorkmanship": 3 },
    { "name": "Iron Greaves",        "description": "Solid iron plates that guard the legs from knee to ankle.",                "category": "Armor",     "slot": "Legs",         "minWorkmanship": 3, "maxWorkmanship": 6 },
    { "name": "Padded Trousers",     "description": "Quilted trousers reinforced at vulnerable joints.",                        "category": "Armor",     "slot": "Legs",         "minWorkmanship": 1, "maxWorkmanship": 2 },

    { "name": "Leather Gloves",      "description": "Supple leather gauntlets offering grip and minor protection.",             "category": "Armor",     "slot": "Hands",        "minWorkmanship": 1, "maxWorkmanship": 3 },
    { "name": "Iron Vambraces",      "description": "Hinged iron arm guards strapped over the forearms.",                       "category": "Armor",     "slot": "Hands",        "minWorkmanship": 3, "maxWorkmanship": 6 },
    { "name": "Wrapped Handguards",  "description": "Strips of heavy cloth wound tight around the knuckles and wrists.",        "category": "Armor",     "slot": "Hands",        "minWorkmanship": 1, "maxWorkmanship": 2 },

    { "name": "Leather Boots",       "description": "Sturdy boots of thick-tanned hide. Dependable on rough trails.",           "category": "Armor",     "slot": "Feet",         "minWorkmanship": 1, "maxWorkmanship": 3 },
    { "name": "Iron Sabatons",       "description": "Articulated iron foot armor. Loud on stone, solid everywhere.",            "category": "Armor",     "slot": "Feet",         "minWorkmanship": 3, "maxWorkmanship": 6 },
    { "name": "Traveler's Sandals",  "description": "Light sandals of braided leather. Fast and quiet.",                        "category": "Armor",     "slot": "Feet",         "minWorkmanship": 1, "maxWorkmanship": 2 },

    { "name": "Bone Ring",           "description": "A ring carved from yellowed bone. Carries a faint Wyrd resonance.",        "category": "Accessory", "slot": "Accessory",    "minWorkmanship": 1, "maxWorkmanship": 3 },
    { "name": "Silver Amulet",       "description": "A small silver disc on a chain, engraved with a warding sigil.",           "category": "Accessory", "slot": "Accessory",    "minWorkmanship": 2, "maxWorkmanship": 5 },
    { "name": "Wyrd Charm",          "description": "A knotted cord strung with crystalline fragments. Unsettling to hold.",    "category": "Accessory", "slot": "Accessory",    "minWorkmanship": 3, "maxWorkmanship": 7 },

    { "name": "Iron Ore",            "description": "Rough lumps of iron ore, ready for the smelter.",                         "category": "Component", "slot": "None",         "minWorkmanship": 1, "maxWorkmanship": 2 },
    { "name": "Beast Hide",          "description": "Thick hide stripped from a slain creature.",                              "category": "Component", "slot": "None",         "minWorkmanship": 1, "maxWorkmanship": 2 },
    { "name": "Sinew",               "description": "Dried sinew — useful in bowstrings and bindings.",                        "category": "Component", "slot": "None",         "minWorkmanship": 1, "maxWorkmanship": 2 },
    { "name": "Thornwood Herb",      "description": "A bitter medicinal herb found only in the Thornwood.",                    "category": "Reagent",   "slot": "None",         "minWorkmanship": 1, "maxWorkmanship": 3 },
    { "name": "Dravenite Dust",      "description": "Fine crystalline powder with latent magical resonance. Used in restoration imbuing.", "category": "Reagent", "slot": "None", "minWorkmanship": 2, "maxWorkmanship": 4 },
    { "name": "Bone Fragment",       "description": "A large bone fragment — useful as a crafting material.",                  "category": "Component", "slot": "None",         "minWorkmanship": 1, "maxWorkmanship": 2 },
    { "name": "Wyrd Shard",          "description": "A jagged shard of crystallised Wyrd-energy. Handle with care.",           "category": "Reagent",   "slot": "None",         "minWorkmanship": 3, "maxWorkmanship": 7 }
  ],

  "rareSlotBoost": {
    "dangerThreshold": 7,
    "slots": ["Focus", "Accessory"],
    "extraWeight": 1,
    "comment": "At danger>=threshold each listed slot's templates are added one extra copy to the pool (doubling their weight)."
  },

  "dropPools": [
    {
      "id": "common-materials",
      "entries": [
        { "itemName": "Iron Ore",      "description": "Rough lumps of iron ore, ready for the smelter.",             "category": "Component", "minWorkmanship": 1, "maxWorkmanship": 2, "weight": 1 },
        { "itemName": "Stone",         "description": "A chunk of rough stone. Basic building and crafting material.","category": "Component", "minWorkmanship": 1, "maxWorkmanship": 2, "weight": 1 },
        { "itemName": "Wood",          "description": "A length of raw timber, cut and dried for crafting.",         "category": "Component", "minWorkmanship": 1, "maxWorkmanship": 2, "weight": 1 },
        { "itemName": "Leather",       "description": "Tanned hide suitable for armor and bindings.",                "category": "Component", "minWorkmanship": 1, "maxWorkmanship": 2, "weight": 1 },
        { "itemName": "Sinew",         "description": "Dried sinew — useful in bowstrings and bindings.",            "category": "Component", "minWorkmanship": 1, "maxWorkmanship": 2, "weight": 1 },
        { "itemName": "Bone Fragment", "description": "A large bone fragment — useful as a crafting material.",      "category": "Component", "minWorkmanship": 1, "maxWorkmanship": 2, "weight": 1 }
      ]
    },
    {
      "id": "biome-mountain",
      "entries": [